,Announcement_Date,PURPOSE,EGM_DATE,REMARKS
0,ANNOUNCEMENT DATE,PURPOSE,EGM DATE,REMARKS
1,01-02-2017,EGM,31-01-2017,Mohini  Fibers Limited  has informed the Exchange re...
2,29-08-2017,EGM,29-08-2017,Mohini Fibers Limited has submitted the Exchange a c...
3,29-08-2016,EGM,27-08-2016,Mohini  Fibers Limited has certified a Copy of the C...
4,17-08-2016,EGM,19-08-2016,Mohini  Fibers  Limited has informed the Exchange th...
5,05-05-2017,EGM,04-05-2017,Shareholders  meeting  Mohini  Fibers Limited  has i...
